### ISSUE TITLE
MVS believes there is always an unknown alarm raised.

### ISSUE THREAD

**Issue by AME2** [Metaswitch/clearwater-snmp-handlers#144]
#### Symptoms
When testing MVS alarms integration I noticed the nodes are constantly reported as being in a bad state. When looking at the alarms raised on each node there is an alarm permanently raised in an 'Unknown' state with no alarm information. 
A tcp dump of port 162 showed me that immediately after we send an Inform raising an alarm we send a V2Trap:
16:39:55.063567 IP 10.225.20.168.38783 > 10.225.20.190.snmp-trap:  C=clearwater Inform(106)  system.sysUpTime.0=20263 S:1.1.4.1.0=118.0.2 118.1.2.2.1.13.0=11                                                                                8.1.1.2.1.3.0.1008.5 118.1.2.2.1.10.0=.0.0
16:39:55.063770 IP 10.225.20.168.45487 > 10.225.20.190.snmp-trap:  V2Trap(106)  system.sysUpTime.0=20263 S:1.1.4.1.0=118.0.2 118.1.2.2.1.13.0=118.1.1.2.1.3.0                                                                                .1008.5 118.1.2.2.1.10.0=.0.0
16:39:55.074544 IP 10.225.20.190.snmp-trap > 10.225.20.168.38783:  C=clearwater GetResponse(106)  system.sysUpTime.0=20263 S:1.1.4.1.0=118.0.2 118.1.2.2.1.13                                                                                .0=118.1.1.2.1.3.0.1008.5 118.1.2.2.1.10.0=.0.0
This V2Trap may be the source of the unknown alarm.

#### Impact
This is stopping me from signing off on the MVS alarms integrating testing test plan.

#### Release and environment 
I've been testing using the vmware MVS with address 10.225.20.190 and the vmware's Clearwater nodes. 

#### Steps to reproduce
Install MVS and start it monitoring one of the above nodes.

**Comment by mirw** [comment]
I'll take a look.

**Comment by mirw** [comment]
2 SNMP messages are sent.

*   `cw_alarm_agent` sends an INFORM.  (This is correct.)
*   `snmpd` sends a v2 TRAP.  (This is not.)

The reason `snmpd` sends the TRAP is that `cw_alarm_agent` registered with it over AgentX, and `snmpd` has a `trap2sink` configuration line in its `/etc/snmp/snmpd.conf`.

I think the fix is to remove the `trap2sink` configuration line, but I need to check that this isn't needed for other (non-`cw_alarm_agent`-generated) TRAPs.

**Comment by mirw** [comment]
@chris-elford-metaswitch, as discussed, the right specification here isn't completely clear - I think we maybe want to allow both TRAPs and INFORMs to different sinks.  You're going to have a think.

**Comment by mirw** [comment]
A quick update - it may be that the configuration in `/etc/snmp/snmpd.conf` was stale, from a previous version.

**Comment by AME2** [comment]
I've retested and can confirm there is no longer an 'unknown' alarm in MVS. I've also retested the resend alarm notifications until you receive an acknowledgment functionality and it still works.
